{
  "schema_version": "1.0",
  "year": 2026,
  "month": 8,
  "level": "middle_school",
  "block": "B",
  "days": [
    {
      "date": "2026-08-26",
      "weekday": "水",
      "status": "scheduled",
      "menu": [
        "コッペパン",
        "ミネストローネ",
        "（揚）フライドチキン",
        "キャベツとハムのソテー",
        "チョコレートクリーム"
      ],
      "beverages": [
        "牛乳"
      ]
    },
    {
      "date": "2026-08-27",
      "weekday": "木",
      "status": "scheduled",
      "menu": [
        "ごはん",
        "トックスープ",
        "コーンしゅうまい",
        "チャプチェ",
        "大根サラダ"
      ],
      "beverages": [
        "牛乳"
      ]
    },
    {
      "date": "2026-08-28",
      "weekday": "金",
      "status": "scheduled",
      "menu": [
        "ごはん",
        "スタミナ炒め",
        "（揚）いかフライ",
        "ささみサラダ",
        "枝豆"
      ],
      "beverages": [
        "牛乳"
      ]
    },
    {
      "date": "2026-08-31",
      "weekday": "月",
      "status": "scheduled",
      "menu": [
        "ごはん",
        "夏野菜の米粉チキンカレー",
        "（揚）魚介ナゲット",
        "コールスローサラダ",
        "ツナと人参の炒め物"
      ],
      "beverages": [
        "牛乳"
      ]
    }
  ]
}
