{
  "schema_version": "1.0",
  "year": 2026,
  "month": 10,
  "level": "elementary_school",
  "block": "B",
  "days": [
    {
      "date": "2026-10-01",
      "weekday": "木",
      "status": "scheduled",
      "menu": [
        "コッペパン",
        "ウインナーとレタスのスープ",
        "（揚）とりにくのしおからあげ",
        "やさいたっぷり！ドライカレー"
      ],
      "beverages": [
        "ぎゅうにゅう"
      ],
      "tags": [
        "献立コンテスト最優秀賞メニュー"
      ]
    },
    {
      "date": "2026-10-02",
      "weekday": "金",
      "status": "scheduled",
      "menu": [
        "ごはん",
        "ちゅうかどうふ",
        "（揚）こめこぎょうざ",
        "ひやしちゅうか"
      ],
      "beverages": [
        "ぎゅうにゅう"
      ]
    },
    {
      "date": "2026-10-05",
      "weekday": "月",
      "status": "scheduled",
      "menu": [
        "ごはん",
        "ぶたじる",
        "（揚）ちくわのいそべあげ",
        "きりぼしだいこんのサラダ"
      ],
      "beverages": [
        "ぎゅうにゅう"
      ]
    },
    {
      "date": "2026-10-06",
      "weekday": "火",
      "status": "scheduled",
      "menu": [
        "コッペパン",
        "ラビオリスープ",
        "（焼）とりにくのステーキソースかけ",
        "スラッピージョー"
      ],
      "beverages": [
        "ぎゅうにゅう"
      ]
    },
    {
      "date": "2026-10-07",
      "weekday": "水",
      "status": "scheduled",
      "menu": [
        "ごはん",
        "チキンカレーライス",
        "（焼）ハンバーグ",
        "ぶどう"
      ],
      "beverages": [
        "ぎゅうにゅう"
      ]
    },
    {
      "date": "2026-10-08",
      "weekday": "木",
      "status": "scheduled",
      "menu": [
        "コッペパン",
        "くろまめきなこクリーム",
        "オニオンスープ",
        "（揚）チキンナゲット",
        "ミニやきそば"
      ],
      "beverages": [
        "ぎゅうにゅう"
      ]
    },
    {
      "date": "2026-10-09",
      "weekday": "金",
      "status": "scheduled",
      "menu": [
        "ごはん",
        "あつあげとかぼちゃのにもの",
        "（焼）さけのレモンしょうゆかけ",
        "ささみとチンゲンサイのサラダ",
        "ブルーベリーゼリー（直送）"
      ],
      "beverages": [
        "ぎゅうにゅう"
      ],
      "tags": [
        "目の愛護デーメニュー"
      ]
    },
    {
      "date": "2026-10-13",
      "weekday": "火",
      "status": "scheduled",
      "menu": [
        "コッペパン",
        "ナポリタンスパゲティ",
        "（揚）フレンチポテト",
        "コールスローサラダ"
      ],
      "beverages": [
        "ぎゅうにゅう"
      ]
    },
    {
      "date": "2026-10-14",
      "weekday": "水",
      "status": "scheduled",
      "menu": [
        "ごはん",
        "わかめスープ",
        "（揚）ひとくちいかてんぷら",
        "ぶたキムチ"
      ],
      "beverages": [
        "ぎゅうにゅう"
      ]
    },
    {
      "date": "2026-10-15",
      "weekday": "木",
      "status": "scheduled",
      "menu": [
        "さつまいもパン",
        "ポタージュ",
        "（焼）ポークチャップ",
        "とうふとブロッコリーのサラダ"
      ],
      "beverages": [
        "ぎゅうにゅう"
      ]
    },
    {
      "date": "2026-10-16",
      "weekday": "金",
      "status": "scheduled",
      "menu": [
        "ごはん",
        "ほうれんそうとたまごのスープ",
        "（揚）レバーいりカレーミンチカツ",
        "にんじんシリシリ"
      ],
      "beverages": [
        "ぎゅうにゅう"
      ]
    },
    {
      "date": "2026-10-19",
      "weekday": "月",
      "status": "scheduled",
      "menu": [
        "ごはん",
        "さつまじる",
        "（焼）さばのしおやき",
        "あきのそぼろあんかけ"
      ],
      "beverages": [
        "ぎゅうにゅう"
      ]
    },
    {
      "date": "2026-10-20",
      "weekday": "火",
      "status": "scheduled",
      "menu": [
        "パーカーハウス１こ",
        "タルタルソース",
        "イタリアンスープ",
        "（揚）しろみざかなフライ",
        "アロエいりフルーツミックス"
      ],
      "beverages": [
        "ぎゅうにゅう"
      ]
    },
    {
      "date": "2026-10-21",
      "weekday": "水",
      "status": "scheduled",
      "menu": [
        "きのこごはん",
        "うどんじる",
        "（揚）れんこんのはさみあげ",
        "ぶたにくのしょうがいため"
      ],
      "beverages": [
        "ぎゅうにゅう"
      ]
    },
    {
      "date": "2026-10-22",
      "weekday": "木",
      "status": "scheduled",
      "menu": [
        "こめことうにゅうパン",
        "おじゃがもちのクリームに",
        "たまねぎいりオムレツ",
        "カラフルやさいのサラダ"
      ],
      "beverages": [
        "ぎゅうにゅう"
      ]
    },
    {
      "date": "2026-10-23",
      "weekday": "金",
      "status": "scheduled",
      "menu": [
        "ごはん",
        "マーボーあつあげ",
        "やさいシュウマイ",
        "だいこんサラダ"
      ],
      "beverages": [
        "ぎゅうにゅう"
      ]
    },
    {
      "date": "2026-10-26",
      "weekday": "月",
      "status": "scheduled",
      "menu": [
        "ごはん",
        "たまごいりクッパスープ（きざみのり　クラス1袋）",
        "（揚）ヤンニョムチキン",
        "もやしナムル"
      ],
      "beverages": [
        "ぎゅうにゅう"
      ]
    },
    {
      "date": "2026-10-27",
      "weekday": "火",
      "status": "scheduled",
      "menu": [
        "コッペパン",
        "キャロットスープ",
        "（焼）ぶたにくのりんごソースかけ",
        "マカロニソテー（ドレッシング　クラス１本）"
      ],
      "beverages": [
        "ぎゅうにゅう"
      ]
    },
    {
      "date": "2026-10-28",
      "weekday": "水",
      "status": "scheduled",
      "menu": [
        "ごはん",
        "じゃがいものそぼろに",
        "（焼）さんまのかばやき",
        "れんこんのごまサラダ"
      ],
      "beverages": [
        "ぎゅうにゅう"
      ]
    },
    {
      "date": "2026-10-29",
      "weekday": "木",
      "status": "scheduled",
      "menu": [
        "コッペパン",
        "肉団子とはるさめのスープ",
        "（揚）さつまきなこ",
        "とりにくとやさいのバターいため"
      ],
      "beverages": [
        "ぎゅうにゅう"
      ]
    },
    {
      "date": "2026-10-30",
      "weekday": "金",
      "status": "scheduled",
      "menu": [
        "ごはん",
        "すいとんじる",
        "（揚）コロッケ",
        "ツナのカレーいため"
      ],
      "beverages": [
        "ぎゅうにゅう"
      ]
    }
  ]
}
