{
  "schema_version": "1.0",
  "year": 2026,
  "month": 7,
  "level": "middle_school",
  "block": "C",
  "days": [
    {
      "date": "2026-07-01",
      "weekday": "水",
      "status": "scheduled",
      "menu": [
        "コッペパン",
        "じゃがいものミルクスープ",
        "（揚）たこナゲット",
        "スラッピージョー",
        "いちごとりんごのジャム",
        "きゅうりのピクルス"
      ],
      "beverages": [
        "牛乳"
      ],
      "tags": [
        "半夏生メニュー"
      ]
    },
    {
      "date": "2026-07-02",
      "weekday": "木",
      "status": "scheduled",
      "menu": [
        "ごはん",
        "牛どん",
        "（揚）春巻き",
        "ツナサラダ",
        "枝豆とコーンのソテー"
      ],
      "beverages": [
        "牛乳"
      ]
    },
    {
      "date": "2026-07-03",
      "weekday": "金",
      "status": "scheduled",
      "menu": [
        "ごはん",
        "豚肉のマスタード炒め",
        "（焼）さわらのおろししょうゆかけ",
        "春雨の中華炒め",
        "ひじきふりかけ",
        "ブロッコリーのサラダ"
      ],
      "beverages": [
        "牛乳"
      ]
    },
    {
      "date": "2026-07-06",
      "weekday": "月",
      "status": "scheduled",
      "menu": [
        "ごはん",
        "マーボー厚揚げ",
        "あおさ入り厚焼き卵",
        "鶏肉とキャベツのソテー",
        "あま夏みかん缶"
      ],
      "beverages": [
        "牛乳"
      ]
    },
    {
      "date": "2026-07-07",
      "weekday": "火",
      "status": "scheduled",
      "menu": [
        "ごはん",
        "とうがんのすまし汁",
        "（焼）星型ハンバーグのトマトソースかけ",
        "七夕ゼリー",
        "豚肉とピーマンの炒め物",
        "大豆と昆布の手作りふりかけ"
      ],
      "beverages": [
        "牛乳"
      ],
      "tags": [
        "七夕メニュー"
      ]
    },
    {
      "date": "2026-07-08",
      "weekday": "水",
      "status": "scheduled",
      "menu": [
        "コッペパン",
        "レタススープ",
        "（焼）バジルチキン",
        "切干大根のカレーツナマヨ和え",
        "ジャーマンポテト"
      ],
      "beverages": [
        "牛乳"
      ]
    },
    {
      "date": "2026-07-09",
      "weekday": "木",
      "status": "scheduled",
      "menu": [
        "ごはん",
        "じゃがいもの塩こうじ煮",
        "（揚）さけフライ",
        "ナポリタンスパゲティ",
        "もやしのドレッシング和え"
      ],
      "beverages": [
        "牛乳"
      ]
    },
    {
      "date": "2026-07-10",
      "weekday": "金",
      "status": "scheduled",
      "menu": [
        "ごはん",
        "豆腐入りごま豆乳スープ",
        "（揚）ヤンニョムチキン",
        "ハムのぷるぷる寒天サラダ",
        "ちりめんじゃこと小松菜の炒め物"
      ],
      "beverages": [
        "牛乳"
      ]
    },
    {
      "date": "2026-07-13",
      "weekday": "月",
      "status": "scheduled",
      "menu": [
        "ごはん",
        "豆腐のみそ汁",
        "（焼）さばのよしる干し",
        "こんにゃくと鶏肉の炒め物",
        "春雨の和え物",
        "ゆかりふりかけ"
      ],
      "beverages": [
        "牛乳"
      ]
    },
    {
      "date": "2026-07-14",
      "weekday": "火",
      "status": "scheduled",
      "menu": [
        "ごはん",
        "米粉ポークカレー",
        "野菜入りオムレツ",
        "ささみサラダ",
        "フルーツ杏仁豆腐"
      ],
      "beverages": [
        "牛乳"
      ]
    },
    {
      "date": "2026-07-15",
      "weekday": "水",
      "status": "scheduled",
      "menu": [
        "コッペパン",
        "コンソメスープ",
        "（焼）鶏肉のレモンソースかけ",
        "ラタトゥイユ",
        "ミルククリーム",
        "マッシュポテト"
      ],
      "beverages": [
        "飲むヨーグルト"
      ]
    },
    {
      "date": "2026-07-16",
      "weekday": "木",
      "status": "scheduled",
      "menu": [
        "ごはん",
        "バチ汁",
        "（揚）かつめし",
        "くきわかめの炒め物",
        "キャベツのソテー"
      ],
      "beverages": [
        "牛乳"
      ],
      "tags": [
        "食育の日「兵庫県の食べ物」"
      ]
    }
  ]
}
