{
  "schema_version": "1.0",
  "year": 2026,
  "month": 8,
  "level": "elementary_school",
  "block": "B",
  "days": [
    {
      "date": "2026-08-26",
      "weekday": "水",
      "status": "scheduled",
      "menu": [
        "ごはん",
        "うどんじる",
        "(焼)コロコロあつあげのチリソースかけ",
        "ぶたにくのしょうがいため"
      ],
      "beverages": [
        "ぎゅうにゅう"
      ],
      "tags": [
        "＜2学期＞"
      ]
    },
    {
      "date": "2026-08-27",
      "weekday": "木",
      "status": "scheduled",
      "menu": [
        "コッペパン",
        "たんたんビーフン",
        "（焼）とりにくのステーキソースかけ",
        "カラフルゼリー"
      ],
      "beverages": [
        "ぎゅうにゅう"
      ]
    },
    {
      "date": "2026-08-28",
      "weekday": "金",
      "status": "scheduled",
      "menu": [
        "ごはん",
        "スープカレー",
        "（揚）あげかぼちゃ",
        "えだまめ"
      ],
      "beverages": [
        "ぎゅうにゅう"
      ]
    },
    {
      "date": "2026-08-31",
      "weekday": "月",
      "status": "scheduled",
      "menu": [
        "ごはん",
        "にくだんごのケチャップに",
        "（揚）しろみざかなのフリッター",
        "ウインナーとコーンのソテー"
      ],
      "beverages": [
        "ぎゅうにゅう"
      ]
    }
  ]
}
