{
  "schema_version": "1.0",
  "year": 2026,
  "month": 9,
  "level": "elementary_school",
  "block": "A",
  "days": [
    {
      "date": "2026-09-01",
      "weekday": "火",
      "status": "scheduled",
      "menu": [
        "コッペパン",
        "ミニフルーツゼリー（常温）",
        "ぼうさいシチュー",
        "フランクフルトソーセージ",
        "かんパン"
      ],
      "beverages": [
        "ぎゅうにゅう"
      ],
      "tags": [
        "防災メニュー"
      ]
    },
    {
      "date": "2026-09-02",
      "weekday": "水",
      "status": "scheduled",
      "menu": [
        "ごはん",
        "セルフケチャップライス",
        "オムレツ",
        "ピヨピヨサラダ"
      ],
      "beverages": [
        "ぎゅうにゅう"
      ]
    },
    {
      "date": "2026-09-03",
      "weekday": "木",
      "status": "scheduled",
      "menu": [
        "コッペパン",
        "ウインナーとレタスのスープ",
        "（揚）とりにくのしおからあげ",
        "やさいたっぷり！ドライカレー"
      ],
      "beverages": [
        "ぎゅうにゅう"
      ],
      "tags": [
        "献立コンテスト最優秀賞メニュー"
      ]
    },
    {
      "date": "2026-09-04",
      "weekday": "金",
      "status": "scheduled",
      "menu": [
        "ごはん",
        "ちゅうかどうふ",
        "（揚）こめこぎょうざ",
        "ひやしちゅうか"
      ],
      "beverages": [
        "ぎゅうにゅう"
      ]
    },
    {
      "date": "2026-09-07",
      "weekday": "月",
      "status": "scheduled",
      "menu": [
        "ごはん",
        "ぶたじゃが",
        "（焼）さばのみりんぼし",
        "ささみときゅうりのすのもの"
      ],
      "beverages": [
        "ぎゅうにゅう"
      ]
    },
    {
      "date": "2026-09-08",
      "weekday": "火",
      "status": "scheduled",
      "menu": [
        "コッペパン",
        "にらたまスープ",
        "（揚）あげたこやき",
        "ミニしおやきそば"
      ],
      "beverages": [
        "ぎゅうにゅう"
      ]
    },
    {
      "date": "2026-09-09",
      "weekday": "水",
      "status": "scheduled",
      "menu": [
        "げんまいいりごはん",
        "こめこチキンカレーライス",
        "（揚）ごぼうのミンチカツ",
        "レモンゼリー"
      ],
      "beverages": [
        "ぎゅうにゅう"
      ]
    },
    {
      "date": "2026-09-10",
      "weekday": "木",
      "status": "scheduled",
      "menu": [
        "コッペパン",
        "パンプキンスープ",
        "（焼）ぶたにくのオニオンソースかけ",
        "ツナとブロッコリーのサラダ"
      ],
      "beverages": [
        "ぎゅうにゅう"
      ]
    },
    {
      "date": "2026-09-11",
      "weekday": "金",
      "status": "scheduled",
      "menu": [
        "ごはん",
        "みそにこみうどん",
        "（焼）さわらのゆずしょうゆかけ",
        "わかめのごまずあえ"
      ],
      "beverages": [
        "ぎゅうにゅう"
      ]
    },
    {
      "date": "2026-09-14",
      "weekday": "月",
      "status": "scheduled",
      "menu": [
        "ごはん",
        "せんばじる",
        "（揚）ピーマンにくづめフライ（ソース　クラス1本）",
        "ひじきのいために"
      ],
      "beverages": [
        "ぎゅうにゅう"
      ]
    },
    {
      "date": "2026-09-15",
      "weekday": "火",
      "status": "scheduled",
      "menu": [
        "ロールパン２こ",
        "ズッキーニのスープ",
        "（焼）とりにくのバーベキューソースかけ",
        "ポテトサラダ"
      ],
      "beverages": [
        "ぎゅうにゅう"
      ]
    },
    {
      "date": "2026-09-16",
      "weekday": "水",
      "status": "scheduled",
      "menu": [
        "ごはん",
        "しおとりちゃづけ(卵入り)",
        "（焼）たちうおのしおやき",
        "ぶたにくとえだまめのみそいため"
      ],
      "beverages": [
        "ぎゅうにゅう"
      ]
    },
    {
      "date": "2026-09-17",
      "weekday": "木",
      "status": "scheduled",
      "menu": [
        "あげパン",
        "ポークビーンズ",
        "スパゲティボンゴレ",
        "フローズンヨーグルト（直送）"
      ],
      "beverages": [
        "ぎゅうにゅう"
      ]
    },
    {
      "date": "2026-09-18",
      "weekday": "金",
      "status": "scheduled",
      "menu": [
        "ごはん",
        "とうがんじる",
        "（揚）さかなすりみカツ",
        "ぶたそぼろ"
      ],
      "beverages": [
        "ぎゅうにゅう"
      ]
    },
    {
      "date": "2026-09-24",
      "weekday": "木",
      "status": "scheduled",
      "menu": [
        "コッペパン",
        "ミルククリーム",
        "つくねだんごのスープ",
        "（揚）サーモンフライ",
        "イタリアンサラダ"
      ],
      "beverages": [
        "ぎゅうにゅう"
      ]
    },
    {
      "date": "2026-09-25",
      "weekday": "金",
      "status": "scheduled",
      "menu": [
        "ごはん",
        "よしのじる",
        "（焼）うさぎがたハンバーグのおろしだれかけ",
        "とりにくとさといものにもの",
        "おつきみだんご（直送）"
      ],
      "beverages": [
        "ぎゅうにゅう"
      ],
      "tags": [
        "お月見メニュー"
      ]
    },
    {
      "date": "2026-09-28",
      "weekday": "月",
      "status": "scheduled",
      "menu": [
        "ごはん",
        "ごもくじる",
        "（揚）さといもコロッケ",
        "キャベツとささみのあまずあえ"
      ],
      "beverages": [
        "ぎゅうにゅう"
      ]
    },
    {
      "date": "2026-09-29",
      "weekday": "火",
      "status": "scheduled",
      "menu": [
        "コッペパン",
        "ニョッキのケチャップに",
        "(焼）チキンのチーズオーブンやき",
        "きりぼしだいこんのペペロンチーノ"
      ],
      "beverages": [
        "ぎゅうにゅう"
      ]
    },
    {
      "date": "2026-09-30",
      "weekday": "水",
      "status": "scheduled",
      "menu": [
        "ごはん",
        "あつあげのみそしる",
        "（揚）あじのフライ（ソース　クラス１本）",
        "ぶたにくどんのぐ"
      ],
      "beverages": [
        "ぎゅうにゅう"
      ]
    }
  ]
}
