{
  "schema_version": "1.0",
  "year": 2026,
  "month": 7,
  "level": "middle_school",
  "block": "yotsuba_late",
  "days": [
    {
      "date": "2026-07-01",
      "weekday": "水",
      "status": "scheduled",
      "menu": [
        "ごはん",
        "たこボールのすまし汁",
        "（焼）さばの塩焼き",
        "ごま酢炒め"
      ],
      "beverages": [
        "牛乳"
      ],
      "tags": [
        "半夏生メニュー"
      ]
    },
    {
      "date": "2026-07-02",
      "weekday": "木",
      "status": "scheduled",
      "menu": [
        "ミルクツイスト",
        "ニョッキのケチャップ煮",
        "（揚）チキンナゲット",
        "サイダーゼリー"
      ],
      "beverages": [
        "牛乳"
      ]
    },
    {
      "date": "2026-07-03",
      "weekday": "金",
      "status": "scheduled",
      "menu": [
        "ごはん",
        "韓国海苔",
        "卵入りコーンスープ",
        "にらまんじゅう",
        "ピビンバ"
      ],
      "beverages": [
        "牛乳"
      ]
    },
    {
      "date": "2026-07-06",
      "weekday": "月",
      "status": "scheduled",
      "menu": [
        "ごはん",
        "七夕汁",
        "（揚）星形コロッケ",
        "豚肉のしぐれ煮",
        "七夕ゼリー(直送)"
      ],
      "beverages": [
        "牛乳"
      ],
      "tags": [
        "七夕メニュー"
      ]
    },
    {
      "date": "2026-07-07",
      "weekday": "火",
      "status": "scheduled",
      "menu": [
        "コッペパン",
        "キャロットスープ",
        "（焼）ハンバーグのケチャップソースかけ",
        "鶏肉とズッキーニの黒こしょう炒め"
      ],
      "beverages": [
        "牛乳"
      ]
    },
    {
      "date": "2026-07-08",
      "weekday": "水",
      "status": "scheduled",
      "menu": [
        "わかめごはん",
        "豚汁",
        "（揚）白身魚のフリッター",
        "ささみときゅうりの酢の物"
      ],
      "beverages": [
        "牛乳"
      ]
    },
    {
      "date": "2026-07-09",
      "weekday": "木",
      "status": "scheduled",
      "menu": [
        "コッペパン",
        "ミルククリーム",
        "レタスと春雨のスープ",
        "（焼）鶏肉のオニオンソースかけ",
        "ひきわり大豆のドライカレー"
      ],
      "beverages": [
        "牛乳"
      ]
    },
    {
      "date": "2026-07-10",
      "weekday": "金",
      "status": "scheduled",
      "menu": [
        "ごはん",
        "マーボー豆腐",
        "（揚）棒ぎょうざ",
        "冷やし中華"
      ],
      "beverages": [
        "牛乳"
      ]
    },
    {
      "date": "2026-07-13",
      "weekday": "月",
      "status": "scheduled",
      "menu": [
        "ごはん",
        "鶏そぼろ",
        "あさりのみそ汁",
        "（揚）豊中野菜入りコロッケ",
        "豚肉とピーマンの炒め物"
      ],
      "beverages": [
        "牛乳"
      ]
    },
    {
      "date": "2026-07-14",
      "weekday": "火",
      "status": "scheduled",
      "menu": [
        "コッペパン",
        "ミネストローネ",
        "あらびきフランクフルトソーセージ",
        "コールスローサラダ"
      ],
      "beverages": [
        "のむヨーグルト"
      ]
    },
    {
      "date": "2026-07-15",
      "weekday": "水",
      "status": "scheduled",
      "menu": [
        "ごはん",
        "夏野菜の米粉チキンカレーライス",
        "オムレツ",
        "冷凍みかん"
      ],
      "beverages": [
        "牛乳"
      ]
    },
    {
      "date": "2026-07-16",
      "weekday": "木",
      "status": "scheduled",
      "menu": [
        "コッペパン",
        "わかめスープ",
        "（揚）鶏肉の唐揚げ",
        "ミニ焼きそば"
      ],
      "beverages": [
        "牛乳"
      ]
    }
  ]
}
