{
  "schema_version": "1.0",
  "year": 2026,
  "month": 10,
  "level": "middle_school",
  "block": "yotsuba_late",
  "days": [
    {
      "date": "2026-10-01",
      "weekday": "木",
      "status": "scheduled",
      "menu": [
        "コッペパン",
        "スープ煮",
        "卵ロール",
        "プチプチサラダ"
      ],
      "beverages": [
        "牛乳"
      ]
    },
    {
      "date": "2026-10-02",
      "weekday": "金",
      "status": "scheduled",
      "menu": [
        "ごはん",
        "トックスープ",
        "（焼）チヂミ",
        "ひき肉と野菜のチャプチェ"
      ],
      "beverages": [
        "牛乳"
      ]
    },
    {
      "date": "2026-10-05",
      "weekday": "月",
      "status": "scheduled",
      "menu": [
        "ごはん",
        "納豆（直送）",
        "豚汁",
        "（焼）じゃこ天のてりやき",
        "切干大根の炒め煮"
      ],
      "beverages": [
        "牛乳"
      ]
    },
    {
      "date": "2026-10-06",
      "weekday": "火",
      "status": "scheduled",
      "menu": [
        "コッペパン",
        "ナポリタンスパゲティ",
        "（揚）フレンチポテト",
        "コールスローサラダ"
      ],
      "beverages": [
        "牛乳"
      ]
    },
    {
      "date": "2026-10-07",
      "weekday": "水",
      "status": "scheduled",
      "menu": [
        "ごはん",
        "お魚そぼろ",
        "わかめスープ",
        "（揚）一口いか天ぷら",
        "豚キムチ"
      ],
      "beverages": [
        "牛乳"
      ]
    },
    {
      "date": "2026-10-08",
      "weekday": "木",
      "status": "scheduled",
      "menu": [
        "さつまいもパン",
        "ポタージュ",
        "（焼）ポークチャップ",
        "豆腐とブロッコリーのサラダ"
      ],
      "beverages": [
        "牛乳"
      ]
    },
    {
      "date": "2026-10-09",
      "weekday": "金",
      "status": "scheduled",
      "menu": [
        "ごはん",
        "（160cc）ほうれん草と卵のスープ",
        "（揚）レバー入りカレーミンチカツ",
        "人参シリシリ",
        "ブルーベリーゼリー（直送）"
      ],
      "beverages": [
        "牛乳"
      ],
      "tags": [
        "目の愛護デーメニュー"
      ]
    },
    {
      "date": "2026-10-13",
      "weekday": "火",
      "status": "scheduled",
      "menu": [
        "コッペパン",
        "アプリコットジャム",
        "ラビオリスープ",
        "（焼）鶏肉のステーキソースかけ",
        "スラッピージョー"
      ],
      "beverages": [
        "牛乳"
      ]
    },
    {
      "date": "2026-10-14",
      "weekday": "水",
      "status": "scheduled",
      "menu": [
        "ごはん",
        "チキンカレーライス",
        "（焼）ハンバーグ",
        "ぶどう"
      ],
      "beverages": [
        "牛乳"
      ]
    },
    {
      "date": "2026-10-15",
      "weekday": "木",
      "status": "scheduled",
      "menu": [
        "コッペパン",
        "黒豆きな粉クリーム",
        "オニオンスープ",
        "（揚）チキンナゲット",
        "ミニ焼きそば"
      ],
      "beverages": [
        "牛乳"
      ]
    },
    {
      "date": "2026-10-16",
      "weekday": "金",
      "status": "scheduled",
      "menu": [
        "ごはん",
        "厚揚げとかぼちゃの煮物",
        "（焼）鮭のレモン醤油かけ",
        "ささみとチンゲン菜のサラダ"
      ],
      "beverages": [
        "牛乳"
      ]
    },
    {
      "date": "2026-10-19",
      "weekday": "月",
      "status": "scheduled",
      "menu": [
        "ごはん",
        "卵入りクッパスープ（刻みのり　クラス1袋）",
        "（揚）ヤンニョムチキン",
        "もやしナムル"
      ],
      "beverages": [
        "牛乳"
      ]
    },
    {
      "date": "2026-10-20",
      "weekday": "火",
      "status": "scheduled",
      "menu": [
        "コッペパン",
        "キャロットスープ（米粉）",
        "（焼）豚肉のりんごソースかけ",
        "マカロニソテー（ドレッシング　クラス1本）"
      ],
      "beverages": [
        "牛乳"
      ]
    },
    {
      "date": "2026-10-21",
      "weekday": "水",
      "status": "scheduled",
      "menu": [
        "（後期）きのこごはん",
        "じゃがいものそぼろ煮",
        "（焼）さんまのかば焼",
        "れんこんのごまサラダ"
      ],
      "beverages": [
        "牛乳"
      ]
    },
    {
      "date": "2026-10-22",
      "weekday": "木",
      "status": "scheduled",
      "menu": [
        "コッペパン",
        "ラ・フランスジャム",
        "(160cc) 肉団子と春雨のスープ",
        "（揚）さつまきな粉",
        "鶏肉と野菜のバター炒め"
      ],
      "beverages": [
        "牛乳"
      ]
    },
    {
      "date": "2026-10-23",
      "weekday": "金",
      "status": "scheduled",
      "menu": [
        "ごはん",
        "すいとん汁",
        "（揚）コロッケ",
        "ツナのカレー炒め"
      ],
      "beverages": [
        "牛乳"
      ]
    },
    {
      "date": "2026-10-26",
      "weekday": "月",
      "status": "scheduled",
      "menu": [
        "ごはん",
        "さつま汁",
        "（焼）さばの塩焼き",
        "秋のそぼろあんかけ"
      ],
      "beverages": [
        "牛乳"
      ]
    },
    {
      "date": "2026-10-27",
      "weekday": "火",
      "status": "scheduled",
      "menu": [
        "パーカーハウス",
        "タルタルソース",
        "イタリアンスープ",
        "（揚）白身魚フライ",
        "アロエ入りフルーツミックス"
      ],
      "beverages": [
        "牛乳"
      ]
    },
    {
      "date": "2026-10-28",
      "weekday": "水",
      "status": "scheduled",
      "menu": [
        "ごはん",
        "小魚の佃煮",
        "うどん汁",
        "（揚）れんこんのはさみ揚げ",
        "豚肉のしょうが炒め"
      ],
      "beverages": [
        "牛乳"
      ]
    },
    {
      "date": "2026-10-29",
      "weekday": "木",
      "status": "scheduled",
      "menu": [
        "米粉豆乳パン",
        "おじゃがもちのクリーム煮",
        "玉ねぎ入りオムレツ",
        "カラフル野菜のサラダ"
      ],
      "beverages": [
        "牛乳"
      ]
    },
    {
      "date": "2026-10-30",
      "weekday": "金",
      "status": "scheduled",
      "menu": [
        "ごはん",
        "マーボー厚揚げ",
        "野菜シュウマイ",
        "大根サラダ"
      ],
      "beverages": [
        "牛乳"
      ]
    }
  ]
}
