{
  "schema_version": "1.0",
  "year": 2026,
  "month": 7,
  "level": "elementary_school",
  "block": "A",
  "days": [
    {
      "date": "2026-07-01",
      "weekday": "水",
      "status": "scheduled",
      "menu": [
        "ごはん",
        "たこボールのすましじる",
        "（焼）さばのしおやき",
        "ごまずいため"
      ],
      "beverages": [
        "ぎゅうにゅう"
      ],
      "tags": [
        "半夏生メニュー"
      ]
    },
    {
      "date": "2026-07-02",
      "weekday": "木",
      "status": "scheduled",
      "menu": [
        "ミルクツイスト",
        "ニョッキのケチャップに",
        "（揚）チキンナゲット",
        "サイダーゼリー"
      ],
      "beverages": [
        "ぎゅうにゅう"
      ]
    },
    {
      "date": "2026-07-03",
      "weekday": "金",
      "status": "scheduled",
      "menu": [
        "ごはん",
        "かんこくのり",
        "たまごいりコーンスープ",
        "にらまんじゅう",
        "ピビンバ"
      ],
      "beverages": [
        "ぎゅうにゅう"
      ]
    },
    {
      "date": "2026-07-06",
      "weekday": "月",
      "status": "scheduled",
      "menu": [
        "ごはん",
        "たなばたじる",
        "（揚）ほしがたコロッケ",
        "ぶたにくのしぐれに",
        "たなばたゼリー(直送)"
      ],
      "beverages": [
        "ぎゅうにゅう"
      ],
      "tags": [
        "七夕メニュー"
      ]
    },
    {
      "date": "2026-07-07",
      "weekday": "火",
      "status": "scheduled",
      "menu": [
        "コッペパン",
        "キャロットスープ",
        "（焼）ハンバーグのケチャップソースかけ",
        "とりにくとズッキーニのくろこしょういため"
      ],
      "beverages": [
        "ぎゅうにゅう"
      ]
    },
    {
      "date": "2026-07-08",
      "weekday": "水",
      "status": "scheduled",
      "menu": [
        "わかめごはん",
        "ぶたじる",
        "（揚）しろみざかなのフリッター",
        "ささみときゅうりのすのもの"
      ],
      "beverages": [
        "ぎゅうにゅう"
      ]
    },
    {
      "date": "2026-07-09",
      "weekday": "木",
      "status": "scheduled",
      "menu": [
        "コッペパン",
        "ミルククリーム",
        "レタスとはるさめのスープ",
        "（焼）とりにくのオニオンソースかけ",
        "ひきわりだいずのドライカレー"
      ],
      "beverages": [
        "ぎゅうにゅう"
      ]
    },
    {
      "date": "2026-07-10",
      "weekday": "金",
      "status": "scheduled",
      "menu": [
        "ごはん",
        "マーボーどうふ",
        "（揚）ぼうぎょうざ",
        "ひやしちゅうか"
      ],
      "beverages": [
        "ぎゅうにゅう"
      ]
    },
    {
      "date": "2026-07-13",
      "weekday": "月",
      "status": "scheduled",
      "menu": [
        "ごはん",
        "あさりのみそしる",
        "（揚）とよなかやさいいりコロッケ",
        "ぶたにくとピーマンのいためもの"
      ],
      "beverages": [
        "ぎゅうにゅう"
      ]
    },
    {
      "date": "2026-07-14",
      "weekday": "火",
      "status": "scheduled",
      "menu": [
        "コッペパン",
        "ミネストローネ",
        "あらびきフランクフルトソーセージ",
        "コールスローサラダ"
      ],
      "beverages": [
        "のむヨーグルト"
      ]
    },
    {
      "date": "2026-07-15",
      "weekday": "水",
      "status": "scheduled",
      "menu": [
        "ごはん",
        "なつやさいのこめこチキンカレーライス",
        "オムレツ",
        "れいとうみかん"
      ],
      "beverages": [
        "ぎゅうにゅう"
      ]
    },
    {
      "date": "2026-07-16",
      "weekday": "木",
      "status": "scheduled",
      "menu": [
        "コッペパン",
        "わかめスープ",
        "（揚）とりにくのからあげ",
        "ミニやきそば"
      ],
      "beverages": [
        "ぎゅうにゅう"
      ]
    }
  ]
}
