{
  "schema_version": "1.0",
  "year": 2026,
  "month": 10,
  "level": "middle_school",
  "block": "C",
  "days": [
    {
      "date": "2026-10-01",
      "weekday": "木",
      "status": "scheduled",
      "menu": [
        "ごはん",
        "塩鶏茶づけ（卵入り）",
        "（焼）さばのよしる干し",
        "焼き豚ともやしの和え物",
        "れんこんのきんぴら"
      ],
      "beverages": [
        "牛乳"
      ]
    },
    {
      "date": "2026-10-02",
      "weekday": "金",
      "status": "scheduled",
      "menu": [
        "ごはん",
        "わかめスープ",
        "（揚）ヤンニョムチキン",
        "ハムのぷるぷるサラダ",
        "ブロッコリーのチーズソテー"
      ],
      "beverages": [
        "牛乳"
      ]
    },
    {
      "date": "2026-10-05",
      "weekday": "月",
      "status": "scheduled",
      "menu": [
        "ごはん",
        "マーボー豆腐",
        "玉ねぎ入りオムレツ",
        "キャベツとツナの中華和え",
        "チンゲン菜のにんにく炒め"
      ],
      "beverages": [
        "牛乳"
      ]
    },
    {
      "date": "2026-10-06",
      "weekday": "火",
      "status": "scheduled",
      "menu": [
        "ごはん",
        "肉団子のスープ煮",
        "（焼）あじのみりんしょうゆづけ",
        "ささみサラダ",
        "さつまいもと豚肉の煮物",
        "ゆかりふりかけ"
      ],
      "beverages": [
        "牛乳"
      ]
    },
    {
      "date": "2026-10-07",
      "weekday": "水",
      "status": "scheduled",
      "menu": [
        "コッペパン",
        "きのこスープ",
        "（焼）バジルチキン",
        "スラッピージョー",
        "いちごとりんごのジャム",
        "マッシュポテト"
      ],
      "beverages": [
        "牛乳"
      ]
    },
    {
      "date": "2026-10-08",
      "weekday": "木",
      "status": "scheduled",
      "menu": [
        "ごはん",
        "米粉チキンカレー",
        "（揚）お魚フライ",
        "ブロッコリーとハムのサラダ",
        "野菜炒め"
      ],
      "beverages": [
        "牛乳"
      ]
    },
    {
      "date": "2026-10-09",
      "weekday": "金",
      "status": "scheduled",
      "menu": [
        "ごはん",
        "かぼちゃのみそ汁",
        "豚肉のオニオンソース炒め",
        "ブルーベリータルト",
        "人参しりしり"
      ],
      "beverages": [
        "牛乳"
      ],
      "tags": [
        "目の愛護デーメニュー"
      ]
    },
    {
      "date": "2026-10-13",
      "weekday": "火",
      "status": "scheduled",
      "menu": [
        "ごはん",
        "のっぺい汁",
        "（揚）さけフライ",
        "ごぼうのピリ辛みそ炒め",
        "白菜のゆず風味和え"
      ],
      "beverages": [
        "牛乳"
      ]
    },
    {
      "date": "2026-10-14",
      "weekday": "水",
      "status": "scheduled",
      "menu": [
        "ごはん",
        "プルコギ",
        "五目厚焼き卵",
        "こんにゃくとまいたけの炒め物",
        "ささみとキャベツのごま酢和え"
      ],
      "beverages": [
        "牛乳"
      ]
    },
    {
      "date": "2026-10-15",
      "weekday": "木",
      "status": "scheduled",
      "menu": [
        "菜めし",
        "じゃがいものみそ汁",
        "（揚）鶏肉のから揚げ",
        "マカロニサラダ",
        "ちりめんじゃことほうれん草の炒め物"
      ],
      "beverages": [
        "牛乳"
      ]
    },
    {
      "date": "2026-10-16",
      "weekday": "金",
      "status": "scheduled",
      "menu": [
        "黒糖パン",
        "きのこシチュー",
        "（焼）ハンバーグのケチャップかけ",
        "チンゲン菜のソテー",
        "きゅうりのピクルス"
      ],
      "beverages": [
        "牛乳"
      ]
    },
    {
      "date": "2026-10-19",
      "weekday": "月",
      "status": "scheduled",
      "menu": [
        "ごはん",
        "豚汁",
        "（揚）きびなごカリカリフライ",
        "つけあげとひじきの煮物",
        "さつまいものきんぴら"
      ],
      "beverages": [
        "牛乳"
      ],
      "tags": [
        "「鹿児島県の食べ物」 食育の日"
      ]
    },
    {
      "date": "2026-10-20",
      "weekday": "火",
      "status": "scheduled",
      "menu": [
        "ごはん",
        "鶏すき煮",
        "卵ロール",
        "ツナサラダ",
        "豚肉とれんこんのソテー"
      ],
      "beverages": [
        "牛乳"
      ]
    },
    {
      "date": "2026-10-21",
      "weekday": "水",
      "status": "scheduled",
      "menu": [
        "さつまいもパン",
        "オニオンスープ",
        "（揚）いろどり野菜ミンチカツのソースかけ",
        "ウインナーと大豆のトマト煮",
        "コールスローサラダ",
        "アセロラゼリー"
      ],
      "beverages": [
        "牛乳"
      ]
    },
    {
      "date": "2026-10-22",
      "weekday": "木",
      "status": "scheduled",
      "menu": [
        "ごはん",
        "ホイコーロー",
        "人参しゅうまい",
        "春雨の中華炒め",
        "チンゲン菜の和え物"
      ],
      "beverages": [
        "牛乳"
      ]
    },
    {
      "date": "2026-10-23",
      "weekday": "金",
      "status": "scheduled",
      "menu": [
        "ごはん",
        "米粉ポークカレー",
        "（揚）れんこんのはさみ揚げ",
        "大根のサラダ",
        "フルーツ杏仁豆腐"
      ],
      "beverages": [
        "牛乳"
      ]
    },
    {
      "date": "2026-10-26",
      "weekday": "月",
      "status": "scheduled",
      "menu": [
        "ごはん",
        "厚揚げのみそ汁",
        "（焼）鶏肉のステーキソースかけ",
        "和風スパゲティ",
        "ひじきふりかけ",
        "いんげんのごま和え"
      ],
      "beverages": [
        "牛乳"
      ]
    },
    {
      "date": "2026-10-27",
      "weekday": "火",
      "status": "scheduled",
      "menu": [
        "ごはん",
        "豚肉のマスタード炒め",
        "（揚）豆腐ナゲット",
        "小松菜とささみのサラダ",
        "切干大根の煮物"
      ],
      "beverages": [
        "牛乳"
      ]
    },
    {
      "date": "2026-10-28",
      "weekday": "水",
      "status": "scheduled",
      "menu": [
        "コッペパン",
        "卵入りコーンスープ",
        "（揚）白身魚フライのソースかけ",
        "もやしのカレーソテー",
        "ミルククリーム",
        "すりおろし洋なしゼリー"
      ],
      "beverages": [
        "牛乳"
      ]
    },
    {
      "date": "2026-10-29",
      "weekday": "木",
      "status": "scheduled",
      "menu": [
        "ごはん",
        "豚どん",
        "（焼）お好み焼き",
        "鶏肉とキャベツのソテー",
        "がんもどきの煮物"
      ],
      "beverages": [
        "牛乳"
      ]
    },
    {
      "date": "2026-10-30",
      "weekday": "金",
      "status": "scheduled",
      "menu": [
        "ごはん",
        "中華スープ",
        "（揚）ひじき入りぎょうざ",
        "豆腐チャンプルー",
        "りんご缶",
        "かぼちゃのあま煮"
      ],
      "beverages": [
        "牛乳"
      ]
    }
  ]
}
