{
  "schema_version": "1.0",
  "year": 2026,
  "month": 9,
  "level": "middle_school",
  "block": "A",
  "days": [
    {
      "date": "2026-09-01",
      "weekday": "火",
      "status": "scheduled",
      "menu": [
        "ごはん",
        "防災シチュー",
        "ウインナーソーセージ",
        "保存食で簡単ごま炒め",
        "かんパン",
        "ぶどうゼリー"
      ],
      "beverages": [
        "牛乳"
      ],
      "tags": [
        "防災メニュー"
      ]
    },
    {
      "date": "2026-09-02",
      "weekday": "水",
      "status": "scheduled",
      "menu": [
        "さつまいもパン",
        "鶏肉と玉ねぎのスープ",
        "（揚）ミンチカツ",
        "ナポリタンスパゲティ",
        "フルーツナタデココ"
      ],
      "beverages": [
        "牛乳"
      ]
    },
    {
      "date": "2026-09-03",
      "weekday": "木",
      "status": "scheduled",
      "menu": [
        "ごはん",
        "じゃがいもの塩こうじ煮",
        "あおさ入り厚焼き卵",
        "もやしのマスタード風味和え",
        "ほうれん草の炒め物"
      ],
      "beverages": [
        "牛乳"
      ]
    },
    {
      "date": "2026-09-04",
      "weekday": "金",
      "status": "scheduled",
      "menu": [
        "ごはん",
        "豆腐入りごま豆乳スープ",
        "（焼）鶏肉のレモンソースかけ",
        "ベーコンとじゃがいもの炒め物",
        "きんぴらごぼう"
      ],
      "beverages": [
        "牛乳"
      ]
    },
    {
      "date": "2026-09-07",
      "weekday": "月",
      "status": "scheduled",
      "menu": [
        "ごはん",
        "中華どん",
        "（揚）春巻き",
        "焼きビーフン",
        "パインアップル缶"
      ],
      "beverages": [
        "牛乳"
      ]
    },
    {
      "date": "2026-09-08",
      "weekday": "火",
      "status": "scheduled",
      "menu": [
        "ごはん",
        "チンゲン菜のスープ",
        "豚肉のオイスターソース炒め",
        "春雨サラダ",
        "（焼）カップも食べられるグラタン"
      ],
      "beverages": [
        "牛乳"
      ]
    },
    {
      "date": "2026-09-09",
      "weekday": "水",
      "status": "scheduled",
      "menu": [
        "ごはん",
        "さつまいものみそ汁",
        "（揚）さんまの竜田揚げ",
        "高野豆腐の卵とじ",
        "鶏肉と根菜の煮物"
      ],
      "beverages": [
        "牛乳"
      ]
    },
    {
      "date": "2026-09-10",
      "weekday": "木",
      "status": "scheduled",
      "menu": [
        "ごはん",
        "マーボー厚揚げ",
        "パオズ",
        "ささみのサラダ",
        "じゃこピーマン"
      ],
      "beverages": [
        "牛乳"
      ]
    },
    {
      "date": "2026-09-11",
      "weekday": "金",
      "status": "scheduled",
      "menu": [
        "米粉豆乳パン",
        "ジュリエンヌスープ",
        "（揚）かつおフライ",
        "野菜たっぷり！ドライカレー",
        "かぼちゃのサラダ"
      ],
      "beverages": [
        "牛乳"
      ],
      "tags": [
        "献立コンテスト最優秀賞メニュー"
      ]
    },
    {
      "date": "2026-09-14",
      "weekday": "月",
      "status": "scheduled",
      "menu": [
        "ごはん",
        "五目汁",
        "（焼）さばの塩焼き",
        "豚肉とごぼうのみそ炒め",
        "野菜ふりかけ",
        "さつまいものレモン煮"
      ],
      "beverages": [
        "牛乳"
      ]
    },
    {
      "date": "2026-09-15",
      "weekday": "火",
      "status": "scheduled",
      "menu": [
        "ごはん",
        "ポトフ",
        "（揚）肉団子のあんかけ",
        "チンゲン菜とコーンのソテー",
        "ツナと野菜のサラダ"
      ],
      "beverages": [
        "牛乳"
      ]
    },
    {
      "date": "2026-09-16",
      "weekday": "水",
      "status": "scheduled",
      "menu": [
        "コッペパン",
        "卵スープ",
        "（焼）豚肉のバーベキューソースかけ",
        "ラタトゥイユ",
        "ブロッコリーのソテー"
      ],
      "beverages": [
        "牛乳"
      ]
    },
    {
      "date": "2026-09-17",
      "weekday": "木",
      "status": "scheduled",
      "menu": [
        "いろどりごはん",
        "豚じゃが",
        "（揚）あじフライ",
        "ごぼうのごまサラダ",
        "くきわかめの炒め物"
      ],
      "beverages": [
        "牛乳"
      ]
    },
    {
      "date": "2026-09-18",
      "weekday": "金",
      "status": "scheduled",
      "menu": [
        "ごはん",
        "糸寒天入りすまし汁",
        "（揚）鶏肉の山賊焼き",
        "レタスと春雨のそぼろ炒め",
        "小松菜とえのきのおかか和え",
        "すりおろしりんごゼリー"
      ],
      "beverages": [
        "牛乳"
      ],
      "tags": [
        "食育の日「長野県の食べ物」"
      ]
    },
    {
      "date": "2026-09-24",
      "weekday": "木",
      "status": "scheduled",
      "menu": [
        "ごはん",
        "ハヤシライス",
        "オムレツ",
        "ツナとこんにゃく寒天のサラダ",
        "鶏肉とコーンのバター炒め"
      ],
      "beverages": [
        "牛乳"
      ]
    },
    {
      "date": "2026-09-25",
      "weekday": "金",
      "status": "scheduled",
      "menu": [
        "ごはん",
        "けんちん汁",
        "（焼）照り焼きハンバーグ",
        "もやしのごま和え",
        "かつおふりかけ",
        "たれ入りみたらし団子"
      ],
      "beverages": [
        "牛乳"
      ],
      "tags": [
        "お月見メニュー"
      ]
    },
    {
      "date": "2026-09-28",
      "weekday": "月",
      "status": "scheduled",
      "menu": [
        "ごはん",
        "豆腐のみそ汁",
        "豚肉のしょうが焼き",
        "（揚）竹輪のいそべ揚げ",
        "ハムとキャベツのサラダ"
      ],
      "beverages": [
        "牛乳"
      ]
    },
    {
      "date": "2026-09-29",
      "weekday": "火",
      "status": "scheduled",
      "menu": [
        "ごはん",
        "タッカルビ",
        "野菜しゅうまい",
        "わかめのサラダ",
        "さつまいものあま煮"
      ],
      "beverages": [
        "牛乳"
      ]
    },
    {
      "date": "2026-09-30",
      "weekday": "水",
      "status": "scheduled",
      "menu": [
        "コッペパン",
        "白いんげん豆のポタージュ",
        "（揚）かぼちゃひき肉フライ",
        "小松菜とエリンギのソテー",
        "黒豆きな粉クリーム"
      ],
      "beverages": [
        "牛乳"
      ]
    }
  ]
}
