{
  "schema_version": "1.0",
  "year": 2026,
  "month": 9,
  "level": "middle_school",
  "block": "yotsuba_late",
  "days": [
    {
      "date": "2026-09-01",
      "weekday": "火",
      "status": "scheduled",
      "menu": [
        "コッペパン",
        "ミニフルーツゼリー（常温）",
        "防災シチュー",
        "フランクフルトソーセージ",
        "乾パン"
      ],
      "beverages": [
        "牛乳"
      ],
      "tags": [
        "防災メニュー"
      ]
    },
    {
      "date": "2026-09-02",
      "weekday": "水",
      "status": "scheduled",
      "menu": [
        "ごはん",
        "セルフケチャップライス",
        "（後期）オムレツ",
        "ピヨピヨサラダ"
      ],
      "beverages": [
        "牛乳"
      ]
    },
    {
      "date": "2026-09-03",
      "weekday": "木",
      "status": "scheduled",
      "menu": [
        "コッペパン",
        "ウインナーとレタスのスープ",
        "（揚）鶏肉の塩唐揚げ（重量）",
        "野菜たっぷり！ドライカレー"
      ],
      "beverages": [
        "牛乳"
      ],
      "tags": [
        "献立コンテスト最優秀賞メニュー"
      ]
    },
    {
      "date": "2026-09-04",
      "weekday": "金",
      "status": "scheduled",
      "menu": [
        "ごはん",
        "中華豆腐",
        "（揚）米粉ぎょうざ",
        "冷やし中華"
      ],
      "beverages": [
        "牛乳"
      ]
    },
    {
      "date": "2026-09-07",
      "weekday": "月",
      "status": "scheduled",
      "menu": [
        "ごはん",
        "豚じゃが",
        "（焼）さばのみりん干し",
        "ささみときゅうりの酢の物"
      ],
      "beverages": [
        "牛乳"
      ]
    },
    {
      "date": "2026-09-08",
      "weekday": "火",
      "status": "scheduled",
      "menu": [
        "コッペパン",
        "にら玉スープ",
        "（揚）あげたこ焼き",
        "ミニ塩焼きそば"
      ],
      "beverages": [
        "牛乳"
      ]
    },
    {
      "date": "2026-09-09",
      "weekday": "水",
      "status": "scheduled",
      "menu": [
        "玄米入りごはん",
        "米粉チキンカレーライス",
        "（揚）ごぼうのミンチカツ",
        "レモンゼリー(重量)"
      ],
      "beverages": [
        "牛乳"
      ]
    },
    {
      "date": "2026-09-10",
      "weekday": "木",
      "status": "scheduled",
      "menu": [
        "コッペパン",
        "パンプキンスープ（米粉）",
        "（焼）豚肉のオニオンソースかけ",
        "ツナとブロッコリーのサラダ"
      ],
      "beverages": [
        "牛乳"
      ]
    },
    {
      "date": "2026-09-11",
      "weekday": "金",
      "status": "scheduled",
      "menu": [
        "ごはん",
        "海苔の佃煮",
        "(160㏄)みそにこみうどん",
        "（焼）さわらの柚子醤油かけ",
        "わかめのごま酢和え"
      ],
      "beverages": [
        "牛乳"
      ]
    },
    {
      "date": "2026-09-14",
      "weekday": "月",
      "status": "scheduled",
      "menu": [
        "ごはん",
        "船場汁",
        "（揚）ピーマン肉づめフライ（ソース　クラス1本）",
        "ひじきの炒め煮"
      ],
      "beverages": [
        "牛乳"
      ]
    },
    {
      "date": "2026-09-15",
      "weekday": "火",
      "status": "scheduled",
      "menu": [
        "ロールパン２個",
        "チョコレートクリーム",
        "ズッキーニのスープ",
        "（焼）鶏肉のバーベキューソースかけ",
        "ポテトサラダ"
      ],
      "beverages": [
        "牛乳"
      ]
    },
    {
      "date": "2026-09-16",
      "weekday": "水",
      "status": "scheduled",
      "menu": [
        "ごはん",
        "塩鶏茶づけ(卵入り)",
        "（焼）太刀魚の塩焼き",
        "豚肉と枝豆のみそ炒め"
      ],
      "beverages": [
        "牛乳"
      ]
    },
    {
      "date": "2026-09-17",
      "weekday": "木",
      "status": "scheduled",
      "menu": [
        "揚げパン",
        "ポークビーンズ",
        "スパゲティボンゴレ",
        "フローズンヨーグルト（直送）"
      ],
      "beverages": [
        "牛乳"
      ]
    },
    {
      "date": "2026-09-18",
      "weekday": "金",
      "status": "scheduled",
      "menu": [
        "ごはん",
        "(160cc)とうがん汁",
        "（揚）魚すり身カツ",
        "豚そぼろ（しょうゆ）"
      ],
      "beverages": [
        "牛乳"
      ]
    },
    {
      "date": "2026-09-24",
      "weekday": "木",
      "status": "scheduled",
      "menu": [
        "コッペパン",
        "ミルククリーム",
        "(160cc)つくね団子のスープ",
        "（揚）サーモンフライ",
        "イタリアンサラダ"
      ],
      "beverages": [
        "牛乳"
      ]
    },
    {
      "date": "2026-09-25",
      "weekday": "金",
      "status": "scheduled",
      "menu": [
        "ごはん",
        "吉野汁",
        "（焼）うさぎ型ハンバーグのおろしだれかけ",
        "鶏肉と里いもの煮物",
        "お月見団子（直送）"
      ],
      "beverages": [
        "牛乳"
      ],
      "tags": [
        "お月見メニュー"
      ]
    },
    {
      "date": "2026-09-28",
      "weekday": "月",
      "status": "scheduled",
      "menu": [
        "ごはん",
        "五目汁",
        "（揚）里いもコロッケ",
        "キャベツとささみのあま酢和え"
      ],
      "beverages": [
        "牛乳"
      ]
    },
    {
      "date": "2026-09-29",
      "weekday": "火",
      "status": "scheduled",
      "menu": [
        "コッペパン",
        "ニョッキのケチャップ煮",
        "（焼）チキンのチーズオーブン焼き",
        "切干大根のペペロンチーノ"
      ],
      "beverages": [
        "牛乳"
      ]
    },
    {
      "date": "2026-09-30",
      "weekday": "水",
      "status": "scheduled",
      "menu": [
        "ごはん",
        "厚揚げのみそ汁",
        "（揚）あじのフライ（ソース　クラス１本）",
        "豚肉丼の具"
      ],
      "beverages": [
        "牛乳"
      ]
    }
  ]
}
